No.     Time           Source                Destination           Protocol Length Info
      1 0.000000       192.168.2.12          99.236.34.223         TCP      54     6348 → 50008 [FIN, ACK] Seq=1 Ack=1 Win=1021 Len=0

Frame 1: 54 bytes on wire (432 bits), 54 bytes captured (432 bits) on interface \Device\NPF_{32B55D77-25AA-4BC4-8ACA-82B27C2BC887}, id 0
Ethernet II, Src: IntelCor_3c:fb:c7 (e0:d4:64:3c:fb:c7), Dst: Sagemcom_eb:f9:49 (34:5d:9e:eb:f9:49)
Internet Protocol Version 4, Src: 192.168.2.12, Dst: 99.236.34.223
Transmission Control Protocol, Src Port: 6348, Dst Port: 50008, Seq: 1, Ack: 1, Len: 0

No.     Time           Source                Destination           Protocol Length Info
      2 0.000314       192.168.2.12          99.236.34.223         TCP      66     6356 → 50008 [SYN] Seq=0 Win=64240 Len=0 MSS=1460 WS=256 SACK_PERM

Frame 2: 66 bytes on wire (528 bits), 66 bytes captured (528 bits) on interface \Device\NPF_{32B55D77-25AA-4BC4-8ACA-82B27C2BC887}, id 0
Ethernet II, Src: IntelCor_3c:fb:c7 (e0:d4:64:3c:fb:c7), Dst: Sagemcom_eb:f9:49 (34:5d:9e:eb:f9:49)
Internet Protocol Version 4, Src: 192.168.2.12, Dst: 99.236.34.223
Transmission Control Protocol, Src Port: 6356, Dst Port: 50008, Seq: 0, Len: 0

No.     Time           Source                Destination           Protocol Length Info
      3 0.025589       99.236.34.223         192.168.2.12          TCP      66     50008 → 6356 [SYN, ACK] Seq=0 Ack=1 Win=64240 Len=0 MSS=1452 SACK_PERM WS=128

Frame 3: 66 bytes on wire (528 bits), 66 bytes captured (528 bits) on interface \Device\NPF_{32B55D77-25AA-4BC4-8ACA-82B27C2BC887}, id 0
Ethernet II, Src: Sagemcom_eb:f9:49 (34:5d:9e:eb:f9:49), Dst: IntelCor_3c:fb:c7 (e0:d4:64:3c:fb:c7)
Internet Protocol Version 4, Src: 99.236.34.223, Dst: 192.168.2.12
Transmission Control Protocol, Src Port: 50008, Dst Port: 6356, Seq: 0, Ack: 1, Len: 0

No.     Time           Source                Destination           Protocol Length Info
      4 0.025681       192.168.2.12          99.236.34.223         TCP      54     6356 → 50008 [ACK] Seq=1 Ack=1 Win=262656 Len=0

Frame 4: 54 bytes on wire (432 bits), 54 bytes captured (432 bits) on interface \Device\NPF_{32B55D77-25AA-4BC4-8ACA-82B27C2BC887}, id 0
Ethernet II, Src: IntelCor_3c:fb:c7 (e0:d4:64:3c:fb:c7), Dst: Sagemcom_eb:f9:49 (34:5d:9e:eb:f9:49)
Internet Protocol Version 4, Src: 192.168.2.12, Dst: 99.236.34.223
Transmission Control Protocol, Src Port: 6356, Dst Port: 50008, Seq: 1, Ack: 1, Len: 0

No.     Time           Source                Destination           Protocol Length Info
      5 0.031188       99.236.34.223         192.168.2.12          TCP      54     50008 → 6348 [ACK] Seq=1 Ack=2 Win=501 Len=0

Frame 5: 54 bytes on wire (432 bits), 54 bytes captured (432 bits) on interface \Device\NPF_{32B55D77-25AA-4BC4-8ACA-82B27C2BC887}, id 0
Ethernet II, Src: Sagemcom_eb:f9:49 (34:5d:9e:eb:f9:49), Dst: IntelCor_3c:fb:c7 (e0:d4:64:3c:fb:c7)
Internet Protocol Version 4, Src: 99.236.34.223, Dst: 192.168.2.12
Transmission Control Protocol, Src Port: 50008, Dst Port: 6348, Seq: 1, Ack: 2, Len: 0

No.     Time           Source                Destination           Protocol Length Info
      6 2.271896       192.168.2.12          99.236.34.223         HTTP     600    GET /photos/6.jpeg HTTP/1.1 

Frame 6: 600 bytes on wire (4800 bits), 600 bytes captured (4800 bits) on interface \Device\NPF_{32B55D77-25AA-4BC4-8ACA-82B27C2BC887}, id 0
Ethernet II, Src: IntelCor_3c:fb:c7 (e0:d4:64:3c:fb:c7), Dst: Sagemcom_eb:f9:49 (34:5d:9e:eb:f9:49)
Internet Protocol Version 4, Src: 192.168.2.12, Dst: 99.236.34.223
Transmission Control Protocol, Src Port: 6349, Dst Port: 50008, Seq: 1, Ack: 1, Len: 546
Hypertext Transfer Protocol

No.     Time           Source                Destination           Protocol Length Info
      7 2.295437       99.236.34.223         192.168.2.12          TCP      54     50008 → 6349 [ACK] Seq=1 Ack=547 Win=501 Len=0

Frame 7: 54 bytes on wire (432 bits), 54 bytes captured (432 bits) on interface \Device\NPF_{32B55D77-25AA-4BC4-8ACA-82B27C2BC887}, id 0
Ethernet II, Src: Sagemcom_eb:f9:49 (34:5d:9e:eb:f9:49), Dst: IntelCor_3c:fb:c7 (e0:d4:64:3c:fb:c7)
Internet Protocol Version 4, Src: 99.236.34.223, Dst: 192.168.2.12
Transmission Control Protocol, Src Port: 50008, Dst Port: 6349, Seq: 1, Ack: 547, Len: 0

No.     Time           Source                Destination           Protocol Length Info
      8 2.299464       99.236.34.223         192.168.2.12          TCP      1506   50008 → 6349 [ACK] Seq=1 Ack=547 Win=501 Len=1452 [TCP segment of a reassembled PDU]

Frame 8: 1506 bytes on wire (12048 bits), 1506 bytes captured (12048 bits) on interface \Device\NPF_{32B55D77-25AA-4BC4-8ACA-82B27C2BC887}, id 0
Ethernet II, Src: Sagemcom_eb:f9:49 (34:5d:9e:eb:f9:49), Dst: IntelCor_3c:fb:c7 (e0:d4:64:3c:fb:c7)
Internet Protocol Version 4, Src: 99.236.34.223, Dst: 192.168.2.12
Transmission Control Protocol, Src Port: 50008, Dst Port: 6349, Seq: 1, Ack: 547, Len: 1452

No.     Time           Source                Destination           Protocol Length Info
      9 2.299465       99.236.34.223         192.168.2.12          TCP      1506   50008 → 6349 [PSH, ACK] Seq=1453 Ack=547 Win=501 Len=1452 [TCP segment of a reassembled PDU]

Frame 9: 1506 bytes on wire (12048 bits), 1506 bytes captured (12048 bits) on interface \Device\NPF_{32B55D77-25AA-4BC4-8ACA-82B27C2BC887}, id 0
Ethernet II, Src: Sagemcom_eb:f9:49 (34:5d:9e:eb:f9:49), Dst: IntelCor_3c:fb:c7 (e0:d4:64:3c:fb:c7)
Internet Protocol Version 4, Src: 99.236.34.223, Dst: 192.168.2.12
Transmission Control Protocol, Src Port: 50008, Dst Port: 6349, Seq: 1453, Ack: 547, Len: 1452

No.     Time           Source                Destination           Protocol Length Info
     10 2.299468       99.236.34.223         192.168.2.12          TCP      1506   50008 → 6349 [ACK] Seq=2905 Ack=547 Win=501 Len=1452 [TCP segment of a reassembled PDU]

Frame 10: 1506 bytes on wire (12048 bits), 1506 bytes captured (12048 bits) on interface \Device\NPF_{32B55D77-25AA-4BC4-8ACA-82B27C2BC887}, id 0
Ethernet II, Src: Sagemcom_eb:f9:49 (34:5d:9e:eb:f9:49), Dst: IntelCor_3c:fb:c7 (e0:d4:64:3c:fb:c7)
Internet Protocol Version 4, Src: 99.236.34.223, Dst: 192.168.2.12
Transmission Control Protocol, Src Port: 50008, Dst Port: 6349, Seq: 2905, Ack: 547, Len: 1452

No.     Time           Source                Destination           Protocol Length Info
     11 2.299469       99.236.34.223         192.168.2.12          TCP      1506   50008 → 6349 [PSH, ACK] Seq=4357 Ack=547 Win=501 Len=1452 [TCP segment of a reassembled PDU]

Frame 11: 1506 bytes on wire (12048 bits), 1506 bytes captured (12048 bits) on interface \Device\NPF_{32B55D77-25AA-4BC4-8ACA-82B27C2BC887}, id 0
Ethernet II, Src: Sagemcom_eb:f9:49 (34:5d:9e:eb:f9:49), Dst: IntelCor_3c:fb:c7 (e0:d4:64:3c:fb:c7)
Internet Protocol Version 4, Src: 99.236.34.223, Dst: 192.168.2.12
Transmission Control Protocol, Src Port: 50008, Dst Port: 6349, Seq: 4357, Ack: 547, Len: 1452

No.     Time           Source                Destination           Protocol Length Info
     12 2.299469       99.236.34.223         192.168.2.12          TCP      1506   50008 → 6349 [ACK] Seq=5809 Ack=547 Win=501 Len=1452 [TCP segment of a reassembled PDU]

Frame 12: 1506 bytes on wire (12048 bits), 1506 bytes captured (12048 bits) on interface \Device\NPF_{32B55D77-25AA-4BC4-8ACA-82B27C2BC887}, id 0
Ethernet II, Src: Sagemcom_eb:f9:49 (34:5d:9e:eb:f9:49), Dst: IntelCor_3c:fb:c7 (e0:d4:64:3c:fb:c7)
Internet Protocol Version 4, Src: 99.236.34.223, Dst: 192.168.2.12
Transmission Control Protocol, Src Port: 50008, Dst Port: 6349, Seq: 5809, Ack: 547, Len: 1452

No.     Time           Source                Destination           Protocol Length Info
     13 2.299551       192.168.2.12          99.236.34.223         TCP      54     6349 → 50008 [ACK] Seq=547 Ack=7261 Win=1026 Len=0

Frame 13: 54 bytes on wire (432 bits), 54 bytes captured (432 bits) on interface \Device\NPF_{32B55D77-25AA-4BC4-8ACA-82B27C2BC887}, id 0
Ethernet II, Src: IntelCor_3c:fb:c7 (e0:d4:64:3c:fb:c7), Dst: Sagemcom_eb:f9:49 (34:5d:9e:eb:f9:49)
Internet Protocol Version 4, Src: 192.168.2.12, Dst: 99.236.34.223
Transmission Control Protocol, Src Port: 6349, Dst Port: 50008, Seq: 547, Ack: 7261, Len: 0

No.     Time           Source                Destination           Protocol Length Info
     14 2.301376       99.236.34.223         192.168.2.12          TCP      1506   50008 → 6349 [PSH, ACK] Seq=7261 Ack=547 Win=501 Len=1452 [TCP segment of a reassembled PDU]

Frame 14: 1506 bytes on wire (12048 bits), 1506 bytes captured (12048 bits) on interface \Device\NPF_{32B55D77-25AA-4BC4-8ACA-82B27C2BC887}, id 0
Ethernet II, Src: Sagemcom_eb:f9:49 (34:5d:9e:eb:f9:49), Dst: IntelCor_3c:fb:c7 (e0:d4:64:3c:fb:c7)
Internet Protocol Version 4, Src: 99.236.34.223, Dst: 192.168.2.12
Transmission Control Protocol, Src Port: 50008, Dst Port: 6349, Seq: 7261, Ack: 547, Len: 1452

No.     Time           Source                Destination           Protocol Length Info
     15 2.301377       99.236.34.223         192.168.2.12          TCP      1506   50008 → 6349 [ACK] Seq=8713 Ack=547 Win=501 Len=1452 [TCP segment of a reassembled PDU]

Frame 15: 1506 bytes on wire (12048 bits), 1506 bytes captured (12048 bits) on interface \Device\NPF_{32B55D77-25AA-4BC4-8ACA-82B27C2BC887}, id 0
Ethernet II, Src: Sagemcom_eb:f9:49 (34:5d:9e:eb:f9:49), Dst: IntelCor_3c:fb:c7 (e0:d4:64:3c:fb:c7)
Internet Protocol Version 4, Src: 99.236.34.223, Dst: 192.168.2.12
Transmission Control Protocol, Src Port: 50008, Dst Port: 6349, Seq: 8713, Ack: 547, Len: 1452

No.     Time           Source                Destination           Protocol Length Info
     16 2.301380       99.236.34.223         192.168.2.12          TCP      1506   50008 → 6349 [PSH, ACK] Seq=10165 Ack=547 Win=501 Len=1452 [TCP segment of a reassembled PDU]

Frame 16: 1506 bytes on wire (12048 bits), 1506 bytes captured (12048 bits) on interface \Device\NPF_{32B55D77-25AA-4BC4-8ACA-82B27C2BC887}, id 0
Ethernet II, Src: Sagemcom_eb:f9:49 (34:5d:9e:eb:f9:49), Dst: IntelCor_3c:fb:c7 (e0:d4:64:3c:fb:c7)
Internet Protocol Version 4, Src: 99.236.34.223, Dst: 192.168.2.12
Transmission Control Protocol, Src Port: 50008, Dst Port: 6349, Seq: 10165, Ack: 547, Len: 1452

No.     Time           Source                Destination           Protocol Length Info
     17 2.301381       99.236.34.223         192.168.2.12          TCP      1506   50008 → 6349 [ACK] Seq=11617 Ack=547 Win=501 Len=1452 [TCP segment of a reassembled PDU]

Frame 17: 1506 bytes on wire (12048 bits), 1506 bytes captured (12048 bits) on interface \Device\NPF_{32B55D77-25AA-4BC4-8ACA-82B27C2BC887}, id 0
Ethernet II, Src: Sagemcom_eb:f9:49 (34:5d:9e:eb:f9:49), Dst: IntelCor_3c:fb:c7 (e0:d4:64:3c:fb:c7)
Internet Protocol Version 4, Src: 99.236.34.223, Dst: 192.168.2.12
Transmission Control Protocol, Src Port: 50008, Dst Port: 6349, Seq: 11617, Ack: 547, Len: 1452

No.     Time           Source                Destination           Protocol Length Info
     18 2.301442       192.168.2.12          99.236.34.223         TCP      54     6349 → 50008 [ACK] Seq=547 Ack=13069 Win=1026 Len=0

Frame 18: 54 bytes on wire (432 bits), 54 bytes captured (432 bits) on interface \Device\NPF_{32B55D77-25AA-4BC4-8ACA-82B27C2BC887}, id 0
Ethernet II, Src: IntelCor_3c:fb:c7 (e0:d4:64:3c:fb:c7), Dst: Sagemcom_eb:f9:49 (34:5d:9e:eb:f9:49)
Internet Protocol Version 4, Src: 192.168.2.12, Dst: 99.236.34.223
Transmission Control Protocol, Src Port: 6349, Dst Port: 50008, Seq: 547, Ack: 13069, Len: 0

No.     Time           Source                Destination           Protocol Length Info
     19 2.303336       99.236.34.223         192.168.2.12          TCP      1506   50008 → 6349 [PSH, ACK] Seq=13069 Ack=547 Win=501 Len=1452 [TCP segment of a reassembled PDU]

Frame 19: 1506 bytes on wire (12048 bits), 1506 bytes captured (12048 bits) on interface \Device\NPF_{32B55D77-25AA-4BC4-8ACA-82B27C2BC887}, id 0
Ethernet II, Src: Sagemcom_eb:f9:49 (34:5d:9e:eb:f9:49), Dst: IntelCor_3c:fb:c7 (e0:d4:64:3c:fb:c7)
Internet Protocol Version 4, Src: 99.236.34.223, Dst: 192.168.2.12
Transmission Control Protocol, Src Port: 50008, Dst Port: 6349, Seq: 13069, Ack: 547, Len: 1452

No.     Time           Source                Destination           Protocol Length Info
     20 2.303381       192.168.2.12          99.236.34.223         TCP      54     6349 → 50008 [ACK] Seq=547 Ack=14521 Win=1026 Len=0

Frame 20: 54 bytes on wire (432 bits), 54 bytes captured (432 bits) on interface \Device\NPF_{32B55D77-25AA-4BC4-8ACA-82B27C2BC887}, id 0
Ethernet II, Src: IntelCor_3c:fb:c7 (e0:d4:64:3c:fb:c7), Dst: Sagemcom_eb:f9:49 (34:5d:9e:eb:f9:49)
Internet Protocol Version 4, Src: 192.168.2.12, Dst: 99.236.34.223
Transmission Control Protocol, Src Port: 6349, Dst Port: 50008, Seq: 547, Ack: 14521, Len: 0

No.     Time           Source                Destination           Protocol Length Info
     21 2.319552       99.236.34.223         192.168.2.12          TCP      1506   50008 → 6349 [ACK] Seq=14521 Ack=547 Win=501 Len=1452 [TCP segment of a reassembled PDU]

Frame 21: 1506 bytes on wire (12048 bits), 1506 bytes captured (12048 bits) on interface \Device\NPF_{32B55D77-25AA-4BC4-8ACA-82B27C2BC887}, id 0
Ethernet II, Src: Sagemcom_eb:f9:49 (34:5d:9e:eb:f9:49), Dst: IntelCor_3c:fb:c7 (e0:d4:64:3c:fb:c7)
Internet Protocol Version 4, Src: 99.236.34.223, Dst: 192.168.2.12
Transmission Control Protocol, Src Port: 50008, Dst Port: 6349, Seq: 14521, Ack: 547, Len: 1452

No.     Time           Source                Destination           Protocol Length Info
     22 2.319553       99.236.34.223         192.168.2.12          TCP      1506   50008 → 6349 [PSH, ACK] Seq=15973 Ack=547 Win=501 Len=1452 [TCP segment of a reassembled PDU]

Frame 22: 1506 bytes on wire (12048 bits), 1506 bytes captured (12048 bits) on interface \Device\NPF_{32B55D77-25AA-4BC4-8ACA-82B27C2BC887}, id 0
Ethernet II, Src: Sagemcom_eb:f9:49 (34:5d:9e:eb:f9:49), Dst: IntelCor_3c:fb:c7 (e0:d4:64:3c:fb:c7)
Internet Protocol Version 4, Src: 99.236.34.223, Dst: 192.168.2.12
Transmission Control Protocol, Src Port: 50008, Dst Port: 6349, Seq: 15973, Ack: 547, Len: 1452

No.     Time           Source                Destination           Protocol Length Info
     23 2.319556       99.236.34.223         192.168.2.12          TCP      1506   50008 → 6349 [ACK] Seq=17425 Ack=547 Win=501 Len=1452 [TCP segment of a reassembled PDU]

Frame 23: 1506 bytes on wire (12048 bits), 1506 bytes captured (12048 bits) on interface \Device\NPF_{32B55D77-25AA-4BC4-8ACA-82B27C2BC887}, id 0
Ethernet II, Src: Sagemcom_eb:f9:49 (34:5d:9e:eb:f9:49), Dst: IntelCor_3c:fb:c7 (e0:d4:64:3c:fb:c7)
Internet Protocol Version 4, Src: 99.236.34.223, Dst: 192.168.2.12
Transmission Control Protocol, Src Port: 50008, Dst Port: 6349, Seq: 17425, Ack: 547, Len: 1452

No.     Time           Source                Destination           Protocol Length Info
     24 2.319557       99.236.34.223         192.168.2.12          TCP      1506   50008 → 6349 [PSH, ACK] Seq=18877 Ack=547 Win=501 Len=1452 [TCP segment of a reassembled PDU]

Frame 24: 1506 bytes on wire (12048 bits), 1506 bytes captured (12048 bits) on interface \Device\NPF_{32B55D77-25AA-4BC4-8ACA-82B27C2BC887}, id 0
Ethernet II, Src: Sagemcom_eb:f9:49 (34:5d:9e:eb:f9:49), Dst: IntelCor_3c:fb:c7 (e0:d4:64:3c:fb:c7)
Internet Protocol Version 4, Src: 99.236.34.223, Dst: 192.168.2.12
Transmission Control Protocol, Src Port: 50008, Dst Port: 6349, Seq: 18877, Ack: 547, Len: 1452

No.     Time           Source                Destination           Protocol Length Info
     25 2.319557       99.236.34.223         192.168.2.12          TCP      1506   50008 → 6349 [ACK] Seq=20329 Ack=547 Win=501 Len=1452 [TCP segment of a reassembled PDU]

Frame 25: 1506 bytes on wire (12048 bits), 1506 bytes captured (12048 bits) on interface \Device\NPF_{32B55D77-25AA-4BC4-8ACA-82B27C2BC887}, id 0
Ethernet II, Src: Sagemcom_eb:f9:49 (34:5d:9e:eb:f9:49), Dst: IntelCor_3c:fb:c7 (e0:d4:64:3c:fb:c7)
Internet Protocol Version 4, Src: 99.236.34.223, Dst: 192.168.2.12
Transmission Control Protocol, Src Port: 50008, Dst Port: 6349, Seq: 20329, Ack: 547, Len: 1452

No.     Time           Source                Destination           Protocol Length Info
     26 2.319689       192.168.2.12          99.236.34.223         TCP      54     6349 → 50008 [ACK] Seq=547 Ack=21781 Win=1026 Len=0

Frame 26: 54 bytes on wire (432 bits), 54 bytes captured (432 bits) on interface \Device\NPF_{32B55D77-25AA-4BC4-8ACA-82B27C2BC887}, id 0
Ethernet II, Src: IntelCor_3c:fb:c7 (e0:d4:64:3c:fb:c7), Dst: Sagemcom_eb:f9:49 (34:5d:9e:eb:f9:49)
Internet Protocol Version 4, Src: 192.168.2.12, Dst: 99.236.34.223
Transmission Control Protocol, Src Port: 6349, Dst Port: 50008, Seq: 547, Ack: 21781, Len: 0

No.     Time           Source                Destination           Protocol Length Info
     27 2.321935       99.236.34.223         192.168.2.12          TCP      1506   50008 → 6349 [PSH, ACK] Seq=21781 Ack=547 Win=501 Len=1452 [TCP segment of a reassembled PDU]

Frame 27: 1506 bytes on wire (12048 bits), 1506 bytes captured (12048 bits) on interface \Device\NPF_{32B55D77-25AA-4BC4-8ACA-82B27C2BC887}, id 0
Ethernet II, Src: Sagemcom_eb:f9:49 (34:5d:9e:eb:f9:49), Dst: IntelCor_3c:fb:c7 (e0:d4:64:3c:fb:c7)
Internet Protocol Version 4, Src: 99.236.34.223, Dst: 192.168.2.12
Transmission Control Protocol, Src Port: 50008, Dst Port: 6349, Seq: 21781, Ack: 547, Len: 1452

No.     Time           Source                Destination           Protocol Length Info
     28 2.321936       99.236.34.223         192.168.2.12          TCP      1506   50008 → 6349 [ACK] Seq=23233 Ack=547 Win=501 Len=1452 [TCP segment of a reassembled PDU]

Frame 28: 1506 bytes on wire (12048 bits), 1506 bytes captured (12048 bits) on interface \Device\NPF_{32B55D77-25AA-4BC4-8ACA-82B27C2BC887}, id 0
Ethernet II, Src: Sagemcom_eb:f9:49 (34:5d:9e:eb:f9:49), Dst: IntelCor_3c:fb:c7 (e0:d4:64:3c:fb:c7)
Internet Protocol Version 4, Src: 99.236.34.223, Dst: 192.168.2.12
Transmission Control Protocol, Src Port: 50008, Dst Port: 6349, Seq: 23233, Ack: 547, Len: 1452

No.     Time           Source                Destination           Protocol Length Info
     29 2.321938       99.236.34.223         192.168.2.12          TCP      1506   50008 → 6349 [PSH, ACK] Seq=24685 Ack=547 Win=501 Len=1452 [TCP segment of a reassembled PDU]

Frame 29: 1506 bytes on wire (12048 bits), 1506 bytes captured (12048 bits) on interface \Device\NPF_{32B55D77-25AA-4BC4-8ACA-82B27C2BC887}, id 0
Ethernet II, Src: Sagemcom_eb:f9:49 (34:5d:9e:eb:f9:49), Dst: IntelCor_3c:fb:c7 (e0:d4:64:3c:fb:c7)
Internet Protocol Version 4, Src: 99.236.34.223, Dst: 192.168.2.12
Transmission Control Protocol, Src Port: 50008, Dst Port: 6349, Seq: 24685, Ack: 547, Len: 1452

No.     Time           Source                Destination           Protocol Length Info
     30 2.321938       99.236.34.223         192.168.2.12          TCP      1506   50008 → 6349 [ACK] Seq=26137 Ack=547 Win=501 Len=1452 [TCP segment of a reassembled PDU]

Frame 30: 1506 bytes on wire (12048 bits), 1506 bytes captured (12048 bits) on interface \Device\NPF_{32B55D77-25AA-4BC4-8ACA-82B27C2BC887}, id 0
Ethernet II, Src: Sagemcom_eb:f9:49 (34:5d:9e:eb:f9:49), Dst: IntelCor_3c:fb:c7 (e0:d4:64:3c:fb:c7)
Internet Protocol Version 4, Src: 99.236.34.223, Dst: 192.168.2.12
Transmission Control Protocol, Src Port: 50008, Dst Port: 6349, Seq: 26137, Ack: 547, Len: 1452

No.     Time           Source                Destination           Protocol Length Info
     31 2.321939       99.236.34.223         192.168.2.12          TCP      1506   50008 → 6349 [PSH, ACK] Seq=27589 Ack=547 Win=501 Len=1452 [TCP segment of a reassembled PDU]

Frame 31: 1506 bytes on wire (12048 bits), 1506 bytes captured (12048 bits) on interface \Device\NPF_{32B55D77-25AA-4BC4-8ACA-82B27C2BC887}, id 0
Ethernet II, Src: Sagemcom_eb:f9:49 (34:5d:9e:eb:f9:49), Dst: IntelCor_3c:fb:c7 (e0:d4:64:3c:fb:c7)
Internet Protocol Version 4, Src: 99.236.34.223, Dst: 192.168.2.12
Transmission Control Protocol, Src Port: 50008, Dst Port: 6349, Seq: 27589, Ack: 547, Len: 1452

No.     Time           Source                Destination           Protocol Length Info
     32 2.321939       99.236.34.223         192.168.2.12          TCP      1506   50008 → 6349 [ACK] Seq=29041 Ack=547 Win=501 Len=1452 [TCP segment of a reassembled PDU]

Frame 32: 1506 bytes on wire (12048 bits), 1506 bytes captured (12048 bits) on interface \Device\NPF_{32B55D77-25AA-4BC4-8ACA-82B27C2BC887}, id 0
Ethernet II, Src: Sagemcom_eb:f9:49 (34:5d:9e:eb:f9:49), Dst: IntelCor_3c:fb:c7 (e0:d4:64:3c:fb:c7)
Internet Protocol Version 4, Src: 99.236.34.223, Dst: 192.168.2.12
Transmission Control Protocol, Src Port: 50008, Dst Port: 6349, Seq: 29041, Ack: 547, Len: 1452

No.     Time           Source                Destination           Protocol Length Info
     33 2.321939       99.236.34.223         192.168.2.12          TCP      1506   50008 → 6349 [PSH, ACK] Seq=30493 Ack=547 Win=501 Len=1452 [TCP segment of a reassembled PDU]

Frame 33: 1506 bytes on wire (12048 bits), 1506 bytes captured (12048 bits) on interface \Device\NPF_{32B55D77-25AA-4BC4-8ACA-82B27C2BC887}, id 0
Ethernet II, Src: Sagemcom_eb:f9:49 (34:5d:9e:eb:f9:49), Dst: IntelCor_3c:fb:c7 (e0:d4:64:3c:fb:c7)
Internet Protocol Version 4, Src: 99.236.34.223, Dst: 192.168.2.12
Transmission Control Protocol, Src Port: 50008, Dst Port: 6349, Seq: 30493, Ack: 547, Len: 1452

No.     Time           Source                Destination           Protocol Length Info
     34 2.321940       99.236.34.223         192.168.2.12          TCP      1506   50008 → 6349 [ACK] Seq=31945 Ack=547 Win=501 Len=1452 [TCP segment of a reassembled PDU]

Frame 34: 1506 bytes on wire (12048 bits), 1506 bytes captured (12048 bits) on interface \Device\NPF_{32B55D77-25AA-4BC4-8ACA-82B27C2BC887}, id 0
Ethernet II, Src: Sagemcom_eb:f9:49 (34:5d:9e:eb:f9:49), Dst: IntelCor_3c:fb:c7 (e0:d4:64:3c:fb:c7)
Internet Protocol Version 4, Src: 99.236.34.223, Dst: 192.168.2.12
Transmission Control Protocol, Src Port: 50008, Dst Port: 6349, Seq: 31945, Ack: 547, Len: 1452

No.     Time           Source                Destination           Protocol Length Info
     35 2.322025       192.168.2.12          99.236.34.223         TCP      54     6349 → 50008 [ACK] Seq=547 Ack=33397 Win=1026 Len=0

Frame 35: 54 bytes on wire (432 bits), 54 bytes captured (432 bits) on interface \Device\NPF_{32B55D77-25AA-4BC4-8ACA-82B27C2BC887}, id 0
Ethernet II, Src: IntelCor_3c:fb:c7 (e0:d4:64:3c:fb:c7), Dst: Sagemcom_eb:f9:49 (34:5d:9e:eb:f9:49)
Internet Protocol Version 4, Src: 192.168.2.12, Dst: 99.236.34.223
Transmission Control Protocol, Src Port: 6349, Dst Port: 50008, Seq: 547, Ack: 33397, Len: 0

No.     Time           Source                Destination           Protocol Length Info
     36 2.325437       99.236.34.223         192.168.2.12          TCP      1506   50008 → 6349 [PSH, ACK] Seq=33397 Ack=547 Win=501 Len=1452 [TCP segment of a reassembled PDU]

Frame 36: 1506 bytes on wire (12048 bits), 1506 bytes captured (12048 bits) on interface \Device\NPF_{32B55D77-25AA-4BC4-8ACA-82B27C2BC887}, id 0
Ethernet II, Src: Sagemcom_eb:f9:49 (34:5d:9e:eb:f9:49), Dst: IntelCor_3c:fb:c7 (e0:d4:64:3c:fb:c7)
Internet Protocol Version 4, Src: 99.236.34.223, Dst: 192.168.2.12
Transmission Control Protocol, Src Port: 50008, Dst Port: 6349, Seq: 33397, Ack: 547, Len: 1452

No.     Time           Source                Destination           Protocol Length Info
     37 2.325437       99.236.34.223         192.168.2.12          TCP      1506   50008 → 6349 [ACK] Seq=34849 Ack=547 Win=501 Len=1452 [TCP segment of a reassembled PDU]

Frame 37: 1506 bytes on wire (12048 bits), 1506 bytes captured (12048 bits) on interface \Device\NPF_{32B55D77-25AA-4BC4-8ACA-82B27C2BC887}, id 0
Ethernet II, Src: Sagemcom_eb:f9:49 (34:5d:9e:eb:f9:49), Dst: IntelCor_3c:fb:c7 (e0:d4:64:3c:fb:c7)
Internet Protocol Version 4, Src: 99.236.34.223, Dst: 192.168.2.12
Transmission Control Protocol, Src Port: 50008, Dst Port: 6349, Seq: 34849, Ack: 547, Len: 1452

No.     Time           Source                Destination           Protocol Length Info
     38 2.325439       99.236.34.223         192.168.2.12          TCP      1506   50008 → 6349 [PSH, ACK] Seq=36301 Ack=547 Win=501 Len=1452 [TCP segment of a reassembled PDU]

Frame 38: 1506 bytes on wire (12048 bits), 1506 bytes captured (12048 bits) on interface \Device\NPF_{32B55D77-25AA-4BC4-8ACA-82B27C2BC887}, id 0
Ethernet II, Src: Sagemcom_eb:f9:49 (34:5d:9e:eb:f9:49), Dst: IntelCor_3c:fb:c7 (e0:d4:64:3c:fb:c7)
Internet Protocol Version 4, Src: 99.236.34.223, Dst: 192.168.2.12
Transmission Control Protocol, Src Port: 50008, Dst Port: 6349, Seq: 36301, Ack: 547, Len: 1452

No.     Time           Source                Destination           Protocol Length Info
     39 2.325548       192.168.2.12          99.236.34.223         TCP      54     6349 → 50008 [ACK] Seq=547 Ack=37753 Win=1026 Len=0

Frame 39: 54 bytes on wire (432 bits), 54 bytes captured (432 bits) on interface \Device\NPF_{32B55D77-25AA-4BC4-8ACA-82B27C2BC887}, id 0
Ethernet II, Src: IntelCor_3c:fb:c7 (e0:d4:64:3c:fb:c7), Dst: Sagemcom_eb:f9:49 (34:5d:9e:eb:f9:49)
Internet Protocol Version 4, Src: 192.168.2.12, Dst: 99.236.34.223
Transmission Control Protocol, Src Port: 6349, Dst Port: 50008, Seq: 547, Ack: 37753, Len: 0

No.     Time           Source                Destination           Protocol Length Info
     40 2.328240       99.236.34.223         192.168.2.12          TCP      1506   50008 → 6349 [ACK] Seq=37753 Ack=547 Win=501 Len=1452 [TCP segment of a reassembled PDU]

Frame 40: 1506 bytes on wire (12048 bits), 1506 bytes captured (12048 bits) on interface \Device\NPF_{32B55D77-25AA-4BC4-8ACA-82B27C2BC887}, id 0
Ethernet II, Src: Sagemcom_eb:f9:49 (34:5d:9e:eb:f9:49), Dst: IntelCor_3c:fb:c7 (e0:d4:64:3c:fb:c7)
Internet Protocol Version 4, Src: 99.236.34.223, Dst: 192.168.2.12
Transmission Control Protocol, Src Port: 50008, Dst Port: 6349, Seq: 37753, Ack: 547, Len: 1452

No.     Time           Source                Destination           Protocol Length Info
     41 2.328241       99.236.34.223         192.168.2.12          TCP      1506   50008 → 6349 [PSH, ACK] Seq=39205 Ack=547 Win=501 Len=1452 [TCP segment of a reassembled PDU]

Frame 41: 1506 bytes on wire (12048 bits), 1506 bytes captured (12048 bits) on interface \Device\NPF_{32B55D77-25AA-4BC4-8ACA-82B27C2BC887}, id 0
Ethernet II, Src: Sagemcom_eb:f9:49 (34:5d:9e:eb:f9:49), Dst: IntelCor_3c:fb:c7 (e0:d4:64:3c:fb:c7)
Internet Protocol Version 4, Src: 99.236.34.223, Dst: 192.168.2.12
Transmission Control Protocol, Src Port: 50008, Dst Port: 6349, Seq: 39205, Ack: 547, Len: 1452

No.     Time           Source                Destination           Protocol Length Info
     42 2.328243       99.236.34.223         192.168.2.12          TCP      1506   50008 → 6349 [ACK] Seq=40657 Ack=547 Win=501 Len=1452 [TCP segment of a reassembled PDU]

Frame 42: 1506 bytes on wire (12048 bits), 1506 bytes captured (12048 bits) on interface \Device\NPF_{32B55D77-25AA-4BC4-8ACA-82B27C2BC887}, id 0
Ethernet II, Src: Sagemcom_eb:f9:49 (34:5d:9e:eb:f9:49), Dst: IntelCor_3c:fb:c7 (e0:d4:64:3c:fb:c7)
Internet Protocol Version 4, Src: 99.236.34.223, Dst: 192.168.2.12
Transmission Control Protocol, Src Port: 50008, Dst Port: 6349, Seq: 40657, Ack: 547, Len: 1452

No.     Time           Source                Destination           Protocol Length Info
     43 2.328244       99.236.34.223         192.168.2.12          TCP      1506   50008 → 6349 [PSH, ACK] Seq=42109 Ack=547 Win=501 Len=1452 [TCP segment of a reassembled PDU]

Frame 43: 1506 bytes on wire (12048 bits), 1506 bytes captured (12048 bits) on interface \Device\NPF_{32B55D77-25AA-4BC4-8ACA-82B27C2BC887}, id 0
Ethernet II, Src: Sagemcom_eb:f9:49 (34:5d:9e:eb:f9:49), Dst: IntelCor_3c:fb:c7 (e0:d4:64:3c:fb:c7)
Internet Protocol Version 4, Src: 99.236.34.223, Dst: 192.168.2.12
Transmission Control Protocol, Src Port: 50008, Dst Port: 6349, Seq: 42109, Ack: 547, Len: 1452

No.     Time           Source                Destination           Protocol Length Info
     44 2.328340       192.168.2.12          99.236.34.223         TCP      54     6349 → 50008 [ACK] Seq=547 Ack=43561 Win=1026 Len=0

Frame 44: 54 bytes on wire (432 bits), 54 bytes captured (432 bits) on interface \Device\NPF_{32B55D77-25AA-4BC4-8ACA-82B27C2BC887}, id 0
Ethernet II, Src: IntelCor_3c:fb:c7 (e0:d4:64:3c:fb:c7), Dst: Sagemcom_eb:f9:49 (34:5d:9e:eb:f9:49)
Internet Protocol Version 4, Src: 192.168.2.12, Dst: 99.236.34.223
Transmission Control Protocol, Src Port: 6349, Dst Port: 50008, Seq: 547, Ack: 43561, Len: 0

No.     Time           Source                Destination           Protocol Length Info
     45 2.335461       99.236.34.223         192.168.2.12          HTTP     711    HTTP/1.1 200 OK  (JPEG JFIF image)

Frame 45: 711 bytes on wire (5688 bits), 711 bytes captured (5688 bits) on interface \Device\NPF_{32B55D77-25AA-4BC4-8ACA-82B27C2BC887}, id 0
Ethernet II, Src: Sagemcom_eb:f9:49 (34:5d:9e:eb:f9:49), Dst: IntelCor_3c:fb:c7 (e0:d4:64:3c:fb:c7)
Internet Protocol Version 4, Src: 99.236.34.223, Dst: 192.168.2.12
Transmission Control Protocol, Src Port: 50008, Dst Port: 6349, Seq: 43561, Ack: 547, Len: 657
[31 Reassembled TCP Segments (44217 bytes): #8(1452), #9(1452), #10(1452), #11(1452), #12(1452), #14(1452), #15(1452), #16(1452), #17(1452), #19(1452), #21(1452), #22(1452), #23(1452), #24(1452), #25(1452), #27(1452), #28(1452), #29(1452), ]
Hypertext Transfer Protocol
JPEG File Interchange Format

No.     Time           Source                Destination           Protocol Length Info
     46 2.377693       192.168.2.12          99.236.34.223         TCP      54     6349 → 50008 [ACK] Seq=547 Ack=44218 Win=1024 Len=0

Frame 46: 54 bytes on wire (432 bits), 54 bytes captured (432 bits) on interface \Device\NPF_{32B55D77-25AA-4BC4-8ACA-82B27C2BC887}, id 0
Ethernet II, Src: IntelCor_3c:fb:c7 (e0:d4:64:3c:fb:c7), Dst: Sagemcom_eb:f9:49 (34:5d:9e:eb:f9:49)
Internet Protocol Version 4, Src: 192.168.2.12, Dst: 99.236.34.223
Transmission Control Protocol, Src Port: 6349, Dst Port: 50008, Seq: 547, Ack: 44218, Len: 0

No.     Time           Source                Destination           Protocol Length Info
     47 7.302517       99.236.34.223         192.168.2.12          TCP      54     50008 → 6349 [FIN, ACK] Seq=44218 Ack=547 Win=501 Len=0

Frame 47: 54 bytes on wire (432 bits), 54 bytes captured (432 bits) on interface \Device\NPF_{32B55D77-25AA-4BC4-8ACA-82B27C2BC887}, id 0
Ethernet II, Src: Sagemcom_eb:f9:49 (34:5d:9e:eb:f9:49), Dst: IntelCor_3c:fb:c7 (e0:d4:64:3c:fb:c7)
Internet Protocol Version 4, Src: 99.236.34.223, Dst: 192.168.2.12
Transmission Control Protocol, Src Port: 50008, Dst Port: 6349, Seq: 44218, Ack: 547, Len: 0

No.     Time           Source                Destination           Protocol Length Info
     48 7.302649       192.168.2.12          99.236.34.223         TCP      54     6349 → 50008 [ACK] Seq=547 Ack=44219 Win=1024 Len=0

Frame 48: 54 bytes on wire (432 bits), 54 bytes captured (432 bits) on interface \Device\NPF_{32B55D77-25AA-4BC4-8ACA-82B27C2BC887}, id 0
Ethernet II, Src: IntelCor_3c:fb:c7 (e0:d4:64:3c:fb:c7), Dst: Sagemcom_eb:f9:49 (34:5d:9e:eb:f9:49)
Internet Protocol Version 4, Src: 192.168.2.12, Dst: 99.236.34.223
Transmission Control Protocol, Src Port: 6349, Dst Port: 50008, Seq: 547, Ack: 44219, Len: 0
